[
  {
    "id": "ds-earthquakes-recent",
    "title": "Recent Earthquakes (M2.5+, Last 24h)",
    "description": "Automatically updated GeoJSON feed of recent global seismic activity.",
    "sourceId": "src-usgs-api",
    "tags": [
      "earthquake",
      "seismic",
      "global"
    ]
  },
  {
    "id": "dataset-aftershocks",
    "title": "Recorded Aftershocks (USGS)",
    "description": "Recorded aftershocks in Venezuela since June 23, 2026",
    "sourceId": "src-usgs-api",
    "tags": [
      "seismic",
      "forecast"
    ]
  },
  {
    "id": "dataset-funvisis-earthquakes",
    "title": "FUNVISIS Local Earthquakes",
    "description": "Locally recorded seismic events by the Venezuelan Foundation for Seismological Research",
    "sourceId": "src-funvisis-maravilla",
    "tags": [
      "earthquakes",
      "local",
      "funvisis"
    ]
  },
  {
    "id": "ds-aftershocks",
    "title": "Aftershocks",
    "description": "Seismic aftershock events.",
    "sourceId": "src-aftershocks-placeholder"
  },
  {
    "id": "dataset-hospitals",
    "title": "OpenStreetMap Hospitals (Venezuela)",
    "description": "Verified health facilities sourced from OSM Overpass API.",
    "sourceId": "src-osm-overpass",
    "tags": [
      "hospital",
      "medical",
      "venezuela"
    ]
  },
  {
    "id": "ds-shelters",
    "title": "Shelters",
    "description": "Emergency shelters available for displaced populations.",
    "sourceId": "src-shelters-placeholder"
  },
  {
    "id": "ds-collection-centers-chile",
    "title": "Collection Centers (Chile)",
    "description": "Donation collection centers located in Chile.",
    "sourceId": "src-collection-centers-chile-placeholder"
  },
  {
    "id": "ds-road-closures",
    "title": "Road Closures",
    "description": "Live status of blocked or damaged roads.",
    "sourceId": "src-road-closures-placeholder"
  },
  {
    "id": "ds-damage-assessment",
    "title": "Damage Assessment",
    "description": "Satellite-derived damage assessment maps.",
    "sourceId": "src-damage-assessment-placeholder"
  },
  {
    "id": "ds-satellite-imagery",
    "title": "Satellite Imagery",
    "description": "High-resolution pre and post event imagery.",
    "sourceId": "src-satellite-imagery-placeholder"
  },
  {
    "id": "ds-landslides",
    "title": "Landslides",
    "description": "Identified landslide zones.",
    "sourceId": "src-landslides-placeholder"
  },
  {
    "id": "ds-power-outages",
    "title": "Power Outages",
    "description": "Reported power grid failures.",
    "sourceId": "src-power-outages-placeholder"
  },
  {
    "id": "ds-airports",
    "title": "Airports",
    "description": "Status of regional airports.",
    "sourceId": "src-airports-placeholder"
  },
  {
    "id": "ds-ports",
    "title": "Ports",
    "description": "Status of maritime ports.",
    "sourceId": "src-ports-placeholder"
  },
  {
    "id": "ds-volunteer-organizations",
    "title": "Volunteer Organizations",
    "description": "Active volunteer groups on the ground.",
    "sourceId": "src-volunteer-organizations-placeholder"
  },
  {
    "id": "ds-donation-campaigns",
    "title": "Donation Campaigns",
    "description": "Verified financial donation campaigns.",
    "sourceId": "src-donation-campaigns-placeholder"
  },
  {
    "id": "dataset-faults",
    "title": "GEM Global Active Faults (Venezuela)",
    "description": "Active tectonic faults in the Venezuela region.",
    "sourceId": "src-gem-gafdb",
    "tags": [
      "fault",
      "tectonic",
      "geology"
    ]
  },
  {
    "id": "ds-usgs-geologic-units",
    "title": "USGS Geologic Units (Northern Venezuela)",
    "description": "Geologic polygons from USGS Data Series 199",
    "sourceId": "src-usgs-ds-199",
    "tags": [
      "geology",
      "lithology",
      "age"
    ]
  },
  {
    "id": "ds-satellite-before",
    "title": "Esri World Imagery (Pre-Event Base)",
    "description": "High-resolution global satellite basemap (Esri). Acquisition Date: May 1, 2026.",
    "sourceId": "src-esri-world-imagery",
    "tags": [
      "satellite",
      "optical",
      "before"
    ]
  },
  {
    "id": "ds-satellite-after",
    "title": "Planet Post-Event Imagery",
    "description": "High-resolution post-event satellite imagery acquired on June 26, 2026. Provided by Planet Labs PBC via Source Cooperative. Affected areas are highlighted on the map with a dashed boundary.",
    "sourceId": "src-planet-sourcecoop",
    "tags": [
      "satellite",
      "optical",
      "after",
      "damage"
    ]
  },
  {
    "id": "ds-copernicus-buildings",
    "title": "Copernicus Damage Grading (Buildings)",
    "description": "Rapid mapping damage grading for built-up areas (Polygons and Points)",
    "sourceId": "src-copernicus",
    "tags": [
      "damage",
      "copernicus",
      "buildings"
    ]
  },
  {
    "id": "ds-copernicus-roads",
    "title": "Copernicus Damage Grading (Roads)",
    "description": "Rapid mapping damage grading for transportation networks",
    "sourceId": "src-copernicus",
    "tags": [
      "damage",
      "copernicus",
      "roads"
    ]
  },
  {
    "id": "ds-copernicus-ground-movement",
    "title": "Copernicus Ground Movement",
    "description": "Landslides and earth flow extents",
    "sourceId": "src-copernicus",
    "tags": [
      "damage",
      "copernicus",
      "ground-movement"
    ]
  },
  {
    "id": "ds-nasa-sentinel-damage",
    "title": "NASA Sentinel-1 Damage Proxy Map",
    "description": "Likelihood of damaged structures based on Sentinel-1 radar data.",
    "sourceId": "src-nasa-arcgis",
    "tags": [
      "damage",
      "radar",
      "sentinel"
    ]
  },
  {
    "id": "ds-nasa-interferogram",
    "title": "NASA Sentinel-1 Unwrapped Interferogram",
    "description": "Continuous line-of-sight ground displacement.",
    "sourceId": "src-nasa-arcgis",
    "tags": [
      "interferogram",
      "displacement"
    ]
  },
  {
    "id": "ds-citizen-reports",
    "title": "Citizen Reports",
    "description": "Aggregated citizen reports for missing persons and shelters.",
    "sourceId": "src-citizen-reports",
    "tags": [
      "citizens",
      "humanitarian"
    ]
  }
]